{
  "id": "1_4571",
  "aussage": "Titanstabilisierter austenitischer CrNiMo-Edelstahl 1.4571 (X6CrNiMoTi17-12-2 / AISI 316Ti) nach DIN EN 10088-3 für chemischen Apparatebau.",
  "werte": [
    {
      "name": "Dichte",
      "wert": 8.0,
      "einheit": "kg/dm³"
    },
    {
      "name": "Elastizitaetsmodul bei 20 °C",
      "wert": 200,
      "einheit": "kN/mm²"
    },
    {
      "name": "Querkontraktionszahl",
      "wert": 0.3,
      "einheit": ""
    },
    {
      "name": "Dehngrenze Rp0,2 min. (d <= 160 mm)",
      "wert": 200,
      "einheit": "MPa"
    },
    {
      "name": "Zugfestigkeit Rm",
      "bereich": [
        500,
        700
      ],
      "einheit": "MPa"
    },
    {
      "name": "Bruchdehnung A5 min.",
      "wert": 40,
      "einheit": "%"
    },
    {
      "name": "Haerte max.",
      "wert": 215,
      "einheit": "HB"
    },
    {
      "name": "Waermeleitfaehigkeit bei 20 °C",
      "wert": 15,
      "einheit": "W/(m*K)"
    },
    {
      "name": "Waermeausdehnungskoeffizient (20-100 °C)",
      "wert": 16.0,
      "einheit": "10^-6/K"
    },
    {
      "name": "Max. Dauergebrauchstemperatur",
      "wert": 400,
      "einheit": "°C"
    },
    {
      "name": "Scherfestigkeit τ_B",
      "wert": 400,
      "einheit": "MPa"
    }
  ],
  "geltungsbereich": {
    "werkstoff": [
      "1.4571",
      "X6CrNiMoTi17-12-2",
      "AISI 316Ti",
      "V4A"
    ],
    "verfahren": [
      "Schweissen",
      "Zerspanung",
      "Umformen"
    ],
    "feature": [
      "Druckbehaelter",
      "Flansch",
      "Rohrleitung",
      "Gehaeuse"
    ],
    "groesse": [
      "d <= 160 mm"
    ],
    "festigkeitsklasse": [
      "+AT"
    ]
  },
  "herkunft": "hersteller",
  "quellen": [
    {
      "url": "https://swisssteel-group.com/content-media/documents/_import/1.4571_de.pdf",
      "stelle": "Seite 1-2, Physikalische und mechanische Eigenschaften",
      "zitat": "NICHTROSTENDER AUSTENITISCHER STAHL",
      "abgerufen": "2026-10-30"
    },
    {
      "url": "https://ucpcdn.thyssenkrupp.com/_legacy/UCPthyssenkruppBAMXAustria/assets.files/download/rsh_datenblatt_4571.pdf",
      "stelle": "Seite 1-3, Werkstoffdatenblatt 1.4571",
      "zitat": "Anhaltsangaben für einige physikalische Eigenschaften",
      "abgerufen": "2026-10-30"
    },
    {
      "url": "https://assets.hoffmann-group.com/media/ch/sfs_ch/broschueren_1/technisches_handbuch_fuer_verbindungstechnik/dimensionierung/allgemeines/Mindesteinschraubtiefe_in_geschnittene_Bauteilmuttergewinde_DE.pdf",
      "stelle": "Seite 154, Tabelle Anhaltswerte für Scherfestigkeitsverhältnisse verschiedener Werkstoffsorten",
      "zitat": "Anhaltswerte für Scherfestigkeitsverhältnisse verschiedener Werkstoffsorten",
      "abgerufen": "2026-10-30"
    }
  ],
  "begruendung": "Durch Titan-Stabilisierung wird die Ausscheidung von Chromkarbiden an den Korngrenzen verhindert, sodass auch nach dem Schweißen ohne Nachglühen Beständigkeit gegen interkristalline Korrosion gewährleistet ist.",
  "ausnahmen": "Beim Polieren kann die Titankarbidzeilung zu mikroskopisch unruhiger Oberfläche führen (orange peel); für Reinstraumanwendungen wird häufig 1.4404 bevorzugt.",
  "haerte": "hinweis",
  "pruefstatus": "automatisch",
  "beziehungen": []
}
